{
  "schema_version": "governance.r2-review.v1",
  "record_authority": "PORTAL",
  "delivery_profile": "fixture",
  "read_at": "2026-08-22T10:00:00Z",
  "data": {
    "approval": {
      "approval_id": "AP-R2-DETAIL",
      "gate": "R2",
      "subject_type": "DEPLOYMENT",
      "subject_id": "deployment-paper-1",
      "subject_label": "Paper deployment",
      "release_candidate": null,
      "environment": "PAPER",
      "target_label": "R2 capital review",
      "requester": {
        "user_id": "usr_stan",
        "username": "stan"
      },
      "creator": {
        "user_id": "usr_stan",
        "username": "stan"
      },
      "status": "PENDING",
      "policy_version": "approval.v3",
      "quorum_met": 0,
      "quorum_required": 1,
      "approval_version": 1,
      "evidence_set_hash": "sha256:aaaaaaaaaaaaaaaaaaaaaaaaaaaaaaaaaaaaaaaaaaaaaaaaaaaaaaaaaaaaaaaa",
      "evidence_complete": true,
      "blocker_count": 0,
      "blocker_summary": null,
      "sla_due_at": "2026-08-22T16:00:00Z",
      "expires_at": "2026-08-24T10:00:00Z",
      "created_at": "2026-08-22T10:00:00Z",
      "updated_at": "2026-08-22T10:00:00Z",
      "portfolio_id": "PF_R2_1",
      "currency": "USDT"
    },
    "actor": {
      "user_id": "usr_bobby",
      "username": "bobby",
      "roles": ["ADMIN"]
    },
    "r1_reference": {
      "approval_id": "AP-R1-DETAIL",
      "state": "APPROVED",
      "href": "/governance/approvals/AP-R1-DETAIL/r1",
      "expiry": "2026-08-24T09:30:00Z",
      "digest": "sha256:bbbbbbbbbbbbbbbbbbbbbbbbbbbbbbbbbbbbbbbbbbbbbbbbbbbbbbbbbbbbbbbb",
      "decided_by": "lan",
      "decided_at": "2026-08-22T09:30:00Z"
    },
    "r1_state": "APPROVED",
    "r1_id": "AP-R1-DETAIL",
    "grant_id": "grant-paper-activation-1",
    "grant_name": "paper_activation_authorization",
    "approver_role": "ADMIN",
    "plan_author": "stan",
    "evidence_manifest": {
      "manifest_hash": "sha256:bbbbbbbbbbbbbbbbbbbbbbbbbbbbbbbbbbbbbbbbbbbbbbbbbbbbbbbbbbbbbbbb",
      "complete": true,
      "entries": [
        {
          "evidence_id": "ev-r1-artifact",
          "ordinal": 0,
          "kind": "ALPHA_ARTIFACT",
          "label": "Approved alpha artifact",
          "sha256": "sha256:aaaaaaaaaaaaaaaaaaaaaaaaaaaaaaaaaaaaaaaaaaaaaaaaaaaaaaaaaaaaaaaa",
          "schema_version": "alpha-artifact.v1",
          "source_authority": "RESEARCH",
          "captured_at": "2026-08-22T08:00:00Z"
        }
      ]
    },
    "eligibility": {
      "can_approve": true,
      "can_approve_with_condition": true,
      "can_deny": true,
      "can_request_changes": true,
      "locks": [],
      "separation_of_duties": "OK"
    }
  }
}
